{
  "$schema": "https://json-schema.org/draft/2020-12/schema",
  "$id": "https://urologai.org/contracts/v1/schemas/identifier-set.schema.json",
  "title": "UrologAI v1 canonical identifier set",
  "type": "object",
  "additionalProperties": false,
  "required": ["topic_id", "article_id", "article_revision_id", "claim_id", "claim_revision_id", "component_id", "contribution_id", "review_record_id", "review_coverage_id", "source_id", "source_version_id", "study_family_id", "question_id", "search_record_id", "study_result_id", "appraisal_id", "evidence_profile_id", "guideline_position_id", "generation_run_id", "model_run_id", "gate_result_id", "dependency_edge_id", "challenge_id", "disposition_id", "dose_context_id", "license_record_id", "status_event_id", "release_id"],
  "properties": {
    "topic_id": {"$ref": "common.schema.json#/$defs/topic_id"},
    "article_id": {"$ref": "common.schema.json#/$defs/article_id"},
    "article_revision_id": {"$ref": "common.schema.json#/$defs/article_revision_id"},
    "claim_id": {"$ref": "common.schema.json#/$defs/claim_id"},
    "claim_revision_id": {"$ref": "common.schema.json#/$defs/claim_revision_id"},
    "component_id": {"$ref": "common.schema.json#/$defs/component_id"},
    "contribution_id": {"$ref": "common.schema.json#/$defs/contribution_id"},
    "review_record_id": {"$ref": "common.schema.json#/$defs/review_record_id"},
    "review_coverage_id": {"$ref": "common.schema.json#/$defs/review_coverage_id"},
    "source_id": {"$ref": "common.schema.json#/$defs/source_id"},
    "source_version_id": {"$ref": "common.schema.json#/$defs/source_version_id"},
    "study_family_id": {"$ref": "common.schema.json#/$defs/study_family_id"},
    "question_id": {"$ref": "common.schema.json#/$defs/question_id"},
    "search_record_id": {"$ref": "common.schema.json#/$defs/search_record_id"},
    "study_result_id": {"$ref": "common.schema.json#/$defs/study_result_id"},
    "appraisal_id": {"$ref": "common.schema.json#/$defs/appraisal_id"},
    "evidence_profile_id": {"$ref": "common.schema.json#/$defs/evidence_profile_id"},
    "guideline_position_id": {"$ref": "common.schema.json#/$defs/guideline_position_id"},
    "generation_run_id": {"$ref": "common.schema.json#/$defs/generation_run_id"},
    "model_run_id": {"$ref": "common.schema.json#/$defs/model_run_id"},
    "gate_result_id": {"$ref": "common.schema.json#/$defs/gate_result_id"},
    "dependency_edge_id": {"$ref": "common.schema.json#/$defs/dependency_edge_id"},
    "challenge_id": {"$ref": "common.schema.json#/$defs/challenge_id"},
    "disposition_id": {"$ref": "common.schema.json#/$defs/disposition_id"},
    "dose_context_id": {"$ref": "common.schema.json#/$defs/dose_context_id"},
    "license_record_id": {"$ref": "common.schema.json#/$defs/license_record_id"},
    "status_event_id": {"$ref": "common.schema.json#/$defs/status_event_id"},
    "release_id": {"$ref": "common.schema.json#/$defs/release_id"}
  }
}
