{
  "topic_id": "uro.topic.contract-test",
  "article_id": "uro.article.contract-test",
  "article_revision_id": "uro.article.contract-test.v1",
  "claim_id": "uro.contract-test.0001",
  "claim_revision_id": "uro.contract-test.0001.v1",
  "component_id": "uro.component.contract-test.summary",
  "contribution_id": "uro.contribution.01ARZ3NDEKTSV4RRFFQ69G5FAV",
  "review_record_id": "uro.review-record.01ARZ3NDEKTSV4RRFFQ69G5FBC",
  "review_coverage_id": "uro.review-coverage.01ARZ3NDEKTSV4RRFFQ69G5FAW",
  "source_id": "uro.source.01ARZ3NDEKTSV4RRFFQ69G5FAX",
  "source_version_id": "uro.source-version.01ARZ3NDEKTSV4RRFFQ69G5FAY",
  "study_family_id": "uro.study-family.01ARZ3NDEKTSV4RRFFQ69G5FAZ",
  "question_id": "uro.question.01ARZ3NDEKTSV4RRFFQ69G5FB0",
  "search_record_id": "uro.search-record.01ARZ3NDEKTSV4RRFFQ69G5FB1",
  "study_result_id": "uro.study-result.01ARZ3NDEKTSV4RRFFQ69G5FB2",
  "appraisal_id": "uro.appraisal.01ARZ3NDEKTSV4RRFFQ69G5FB3",
  "evidence_profile_id": "uro.evidence-profile.01ARZ3NDEKTSV4RRFFQ69G5FB4",
  "guideline_position_id": "uro.guideline-position.01ARZ3NDEKTSV4RRFFQ69G5FB5",
  "generation_run_id": "uro.generation-run.01ARZ3NDEKTSV4RRFFQ69G5FB6",
  "model_run_id": "uro.model-run.01ARZ3NDEKTSV4RRFFQ69G5FB7",
  "gate_result_id": "uro.gate-result.01ARZ3NDEKTSV4RRFFQ69G5FB8",
  "dependency_edge_id": "uro.dependency-edge.01ARZ3NDEKTSV4RRFFQ69G5FB9",
  "challenge_id": "uro.challenge.01ARZ3NDEKTSV4RRFFQ69G5FBA",
  "disposition_id": "uro.disposition.01ARZ3NDEKTSV4RRFFQ69G5FBB",
  "dose_context_id": "uro.dose-context.01ARZ3NDEKTSV4RRFFQ69G5FBD",
  "license_record_id": "uro.license.01ARZ3NDEKTSV4RRFFQ69G5FBE",
  "status_event_id": "uro.status-event.01ARZ3NDEKTSV4RRFFQ69G5FBF",
  "release_id": "uro.release.20260923.0001"
}
